{
  "schema": "graphx.fhss.phase3-scenario.v1",
  "scenario_id": "clean_parity_v1",
  "seed": 30000,
  "sample_format": "cf64_le",
  "active_frequency_indices": [24, 28, 32, 36],
  "allow_overlap": false,
  "tail_samples": 0,
  "messages": [{
    "message_id": 1,
    "transmitter_id": 1,
    "transmit_start_sample": 0,
    "initial_phase_rad": 0.0,
    "pulses": [
      {"frequency_index": 24, "word": 2863311530, "role": "preamble"},
      {"frequency_index": 28, "word": 2004318071, "role": "preamble"},
      {"frequency_index": 32, "word": 303174162, "role": "preamble"},
      {"frequency_index": 36, "word": 1650614882, "role": "preamble"},
      {"frequency_index": 24, "word": 2863311530, "role": "preamble"},
      {"frequency_index": 28, "word": 2004318071, "role": "preamble"},
      {"frequency_index": 32, "word": 303174162, "role": "preamble"},
      {"frequency_index": 36, "word": 1650614882, "role": "preamble"},
      {"frequency_index": 24, "word": 2863311530, "role": "preamble"},
      {"frequency_index": 28, "word": 2004318071, "role": "preamble"},
      {"frequency_index": 32, "word": 303174162, "role": "preamble"},
      {"frequency_index": 36, "word": 1650614882, "role": "preamble"},
      {"frequency_index": 24, "word": 2863311530, "role": "preamble"},
      {"frequency_index": 28, "word": 2004318071, "role": "preamble"},
      {"frequency_index": 32, "word": 303174162, "role": "preamble"},
      {"frequency_index": 36, "word": 1650614882, "role": "preamble"}
    ]
  }],
  "channel": {}
}
